[
  {
    "schema_version": "1.0",
    "id": "page:alpha",
    "slug": "alpha",
    "title": "Alpha — Alpha platform",
    "type": "project",
    "created": "2026-08-19",
    "updated": "2026-08-19",
    "tags": [
      "project",
      "cdw-cdisc",
      "정규화"
    ],
    "projects": [
      "alpha-platform"
    ],
    "sources": [],
    "raw_ref": null,
    "summary": "샘플 원본 데이터 입수부터 AlphaStd Export까지 이어지는 정규화 프로젝트 허브.",
    "blocks": {
      "block:alpha:68af80fe31b561db:1": {
        "id": "block:alpha:68af80fe31b561db:1",
        "kind": "heading",
        "data": {
          "level": 1,
          "text": "Alpha — Alpha platform"
        },
        "refs": [],
        "source_text": "# Alpha — Alpha platform",
        "fingerprint": "68af80fe31b561db"
      },
      "block:alpha:52292add95557659:1": {
        "id": "block:alpha:52292add95557659:1",
        "kind": "paragraph",
        "data": {
          "text": "[[terminology-mapping]]과 [[review-queue]]를 중심으로 정규화 흐름을 구성한다."
        },
        "refs": [
          "review-queue",
          "terminology-mapping"
        ],
        "source_text": "[[terminology-mapping]]과 [[review-queue]]를 중심으로 정규화 흐름을 구성한다.",
        "fingerprint": "52292add95557659"
      }
    },
    "block_order": [
      "block:alpha:68af80fe31b561db:1",
      "block:alpha:52292add95557659:1"
    ],
    "links": [
      {
        "target": "terminology-mapping",
        "label": "terminology-mapping",
        "anchor": "",
        "kind": "wiki",
        "block_id": "block:alpha:52292add95557659:1"
      },
      {
        "target": "review-queue",
        "label": "review-queue",
        "anchor": "",
        "kind": "wiki",
        "block_id": "block:alpha:52292add95557659:1"
      }
    ],
    "history": [
      {
        "at": "2026-08-19",
        "action": "created",
        "actor": "system",
        "note": "demo fixture"
      }
    ]
  },
  {
    "schema_version": "1.0",
    "id": "page:beta",
    "slug": "beta",
    "title": "Beta — RefModel Search Engine",
    "type": "project",
    "created": "2026-08-19",
    "updated": "2026-08-19",
    "tags": [
      "project",
      "Beta",
      "검색"
    ],
    "projects": [
      "beta"
    ],
    "sources": [],
    "raw_ref": null,
    "summary": "샘플개념과 샘플항목 개념을 통합 검색하는 프로젝트 허브.",
    "blocks": {
      "block:beta:fcff1bc760ef084a:1": {
        "id": "block:beta:fcff1bc760ef084a:1",
        "kind": "heading",
        "data": {
          "level": 1,
          "text": "Beta — RefModel Search Engine"
        },
        "refs": [],
        "source_text": "# Beta — RefModel Search Engine",
        "fingerprint": "fcff1bc760ef084a"
      },
      "block:beta:0c0c68098315333c:1": {
        "id": "block:beta:0c0c68098315333c:1",
        "kind": "paragraph",
        "data": {
          "text": "[[sample-topic]]와 [[omop-vocabulary]]를 사용한다."
        },
        "refs": [
          "omop-vocabulary",
          "sample-topic"
        ],
        "source_text": "[[sample-topic]]와 [[omop-vocabulary]]를 사용한다.",
        "fingerprint": "0c0c68098315333c"
      }
    },
    "block_order": [
      "block:beta:fcff1bc760ef084a:1",
      "block:beta:0c0c68098315333c:1"
    ],
    "links": [
      {
        "target": "sample-topic",
        "label": "sample-topic",
        "anchor": "",
        "kind": "wiki",
        "block_id": "block:beta:0c0c68098315333c:1"
      },
      {
        "target": "omop-vocabulary",
        "label": "omop-vocabulary",
        "anchor": "",
        "kind": "wiki",
        "block_id": "block:beta:0c0c68098315333c:1"
      }
    ],
    "history": [
      {
        "at": "2026-08-19",
        "action": "created",
        "actor": "system",
        "note": "demo fixture"
      }
    ]
  },
  {
    "schema_version": "1.0",
    "id": "page:terminology-mapping",
    "slug": "terminology-mapping",
    "title": "Terminology Mapping",
    "type": "concept",
    "created": "2026-08-19",
    "updated": "2026-08-19",
    "tags": [
      "용어체계",
      "mapping",
      "정규화"
    ],
    "projects": [
      "alpha-platform"
    ],
    "sources": [
      "source:demo-alpha"
    ],
    "raw_ref": null,
    "summary": "원천 용어를 표준 개념과 연결하고 검수 이력을 보존하는 흐름.",
    "blocks": {
      "block:terminology-mapping:2167cd2e77e5eb03:1": {
        "id": "block:terminology-mapping:2167cd2e77e5eb03:1",
        "kind": "heading",
        "data": {
          "level": 1,
          "text": "Terminology Mapping"
        },
        "refs": [],
        "source_text": "# Terminology Mapping",
        "fingerprint": "2167cd2e77e5eb03"
      },
      "block:terminology-mapping:e524c2571ab0875c:1": {
        "id": "block:terminology-mapping:e524c2571ab0875c:1",
        "kind": "paragraph",
        "data": {
          "text": "후보는 [[omop-vocabulary]]에서 찾고 [[review-queue]]에서 승인한다."
        },
        "refs": [
          "omop-vocabulary",
          "review-queue"
        ],
        "source_text": "후보는 [[omop-vocabulary]]에서 찾고 [[review-queue]]에서 승인한다.",
        "fingerprint": "e524c2571ab0875c"
      }
    },
    "block_order": [
      "block:terminology-mapping:2167cd2e77e5eb03:1",
      "block:terminology-mapping:e524c2571ab0875c:1"
    ],
    "links": [
      {
        "target": "omop-vocabulary",
        "label": "omop-vocabulary",
        "anchor": "",
        "kind": "wiki",
        "block_id": "block:terminology-mapping:e524c2571ab0875c:1"
      },
      {
        "target": "review-queue",
        "label": "review-queue",
        "anchor": "",
        "kind": "wiki",
        "block_id": "block:terminology-mapping:e524c2571ab0875c:1"
      }
    ],
    "history": [
      {
        "at": "2026-08-19",
        "action": "created",
        "actor": "system",
        "note": "demo fixture"
      }
    ]
  },
  {
    "schema_version": "1.0",
    "id": "page:sample-topic",
    "slug": "sample-topic",
    "title": "Sample Topic",
    "type": "concept",
    "created": "2026-08-19",
    "updated": "2026-08-19",
    "tags": [
      "검색",
      "랭킹",
      "샘플개념-검색"
    ],
    "projects": [
      "beta",
      "alpha-platform"
    ],
    "sources": [
      "source:demo-beta"
    ],
    "raw_ref": null,
    "summary": "여러 매칭 유형의 우선순위를 명시적으로 정렬하는 등급 체계.",
    "blocks": {
      "block:sample-topic:5828861393e20db8:1": {
        "id": "block:sample-topic:5828861393e20db8:1",
        "kind": "heading",
        "data": {
          "level": 1,
          "text": "Sample Topic"
        },
        "refs": [],
        "source_text": "# Sample Topic",
        "fingerprint": "5828861393e20db8"
      },
      "block:sample-topic:76ed19a5b933ba70:1": {
        "id": "block:sample-topic:76ed19a5b933ba70:1",
        "kind": "conflict",
        "data": {
          "text": "⚠️ 상충: 문서마다 tier 번호 배열이 다르다 — [[beta]] 전체판 기준과 MVP 기준이 갈린다."
        },
        "refs": [
          "beta"
        ],
        "source_text": "> ⚠️ 상충: 문서마다 tier 번호 배열이 다르다 — [[beta]] 전체판 기준과 MVP 기준이 갈린다.",
        "fingerprint": "76ed19a5b933ba70",
        "resolution": {
          "status": "unresolved"
        }
      }
    },
    "block_order": [
      "block:sample-topic:5828861393e20db8:1",
      "block:sample-topic:76ed19a5b933ba70:1"
    ],
    "links": [
      {
        "target": "beta",
        "label": "beta",
        "anchor": "",
        "kind": "wiki",
        "block_id": "block:sample-topic:76ed19a5b933ba70:1"
      }
    ],
    "history": [
      {
        "at": "2026-08-19",
        "action": "created",
        "actor": "system",
        "note": "demo fixture"
      }
    ]
  },
  {
    "schema_version": "1.0",
    "id": "page:omop-vocabulary",
    "slug": "omop-vocabulary",
    "title": "Reference Vocabulary",
    "type": "concept",
    "created": "2026-08-19",
    "updated": "2026-08-19",
    "tags": [
      "RefModel",
      "용어체계",
      "공통"
    ],
    "projects": [
      "공통"
    ],
    "sources": [],
    "raw_ref": null,
    "summary": "샘플개념·샘플항목·검사 표준 개념과 관계를 제공하는 공통 어휘 계층.",
    "blocks": {
      "block:omop-vocabulary:cbf48ffc167895b6:1": {
        "id": "block:omop-vocabulary:cbf48ffc167895b6:1",
        "kind": "heading",
        "data": {
          "level": 1,
          "text": "Reference Vocabulary"
        },
        "refs": [],
        "source_text": "# Reference Vocabulary",
        "fingerprint": "cbf48ffc167895b6"
      },
      "block:omop-vocabulary:3e8da8550c7f829a:1": {
        "id": "block:omop-vocabulary:3e8da8550c7f829a:1",
        "kind": "paragraph",
        "data": {
          "text": "[[terminology-mapping]]과 [[sample-topic]]가 공유한다."
        },
        "refs": [
          "sample-topic",
          "terminology-mapping"
        ],
        "source_text": "[[terminology-mapping]]과 [[sample-topic]]가 공유한다.",
        "fingerprint": "3e8da8550c7f829a"
      }
    },
    "block_order": [
      "block:omop-vocabulary:cbf48ffc167895b6:1",
      "block:omop-vocabulary:3e8da8550c7f829a:1"
    ],
    "links": [
      {
        "target": "terminology-mapping",
        "label": "terminology-mapping",
        "anchor": "",
        "kind": "wiki",
        "block_id": "block:omop-vocabulary:3e8da8550c7f829a:1"
      },
      {
        "target": "sample-topic",
        "label": "sample-topic",
        "anchor": "",
        "kind": "wiki",
        "block_id": "block:omop-vocabulary:3e8da8550c7f829a:1"
      }
    ],
    "history": [
      {
        "at": "2026-08-19",
        "action": "created",
        "actor": "system",
        "note": "demo fixture"
      }
    ]
  },
  {
    "schema_version": "1.0",
    "id": "page:review-queue",
    "slug": "review-queue",
    "title": "Review Queue",
    "type": "concept",
    "created": "2026-08-19",
    "updated": "2026-08-19",
    "tags": [
      "검수",
      "workflow",
      "정규화"
    ],
    "projects": [
      "alpha-platform"
    ],
    "sources": [],
    "raw_ref": null,
    "summary": "매핑 후보 승인·반려와 근거·검수자·시각을 보존하는 대기열.",
    "blocks": {
      "block:review-queue:b2ae8112f82c895d:1": {
        "id": "block:review-queue:b2ae8112f82c895d:1",